ticker,name,sector,industry,description,source
DIGJAMLMTD,Digjam Ltd,Consumer Cyclical,Textile Manufacturing,"Incorporated in 1948, Digjam Ltd trades in all kinds of textiles and manufactures high quality woolen/ worsted fabrics",screener
DISAQ,Disa India Ltd,,,"Disa India Ltd is a leading equipment manufacturer with advanced foundry and surface preparation process technology. It supplies complete foundry systems, with molding machines, sand mixers with combination of sand plant equipment, surface preparation machines and environmental control systems across the country.",screener
DISHTV,Dish TV India Ltd,Communication Services,Entertainment,"Incorporated in 1988, Dish TV India Ltd is in the business of providing Direct to Home television and Teleport services",screener
DIVGIITTS,Divgi Torqtransfer Systems Ltd,Consumer Cyclical,Auto Parts,"Incorporated in 1964, Divgi Torqtransfer System Ltd manufactures Auto Components and Parts",screener
DIVISLAB,Divis Laboratories Ltd,Healthcare,Drug Manufacturers - Specialty & Generic,"Incorporated in 1990, Divis Laboratories Ltd manufactures and exports API's, Intermediates and Nutraceutical ingredients",screener
DIXON,Dixon Technologies (India) Ltd,Technology,Consumer Electronics,"Dixon Technologies (India) Limited, incorporated in 1993 , is a Electronic Manufacturing Services (EMS) company with operations in the electronic products vertical such as consumer electronics, lighting, home appliance, closed-circuit television cameras (CCTVs), and mobile phones. It also undertakes reverse logistics operations. Besides, it manufactures security surveillance equipment, wearables & audibles, AC-PCBs. Recently, it has entered a JV with Imagine Marketing Private Limited for designing and manufacturing wireless audio solutions in India.",screener
DJML,DJ Mediaprint & Logistics Ltd,Industrials,Specialty Business Services,"Incorporated in 2009, DJ Mediaprint & Logistics Ltd is into Printing business, Record managements & other related business",screener
DLF,DLF Ltd,Real Estate,Real Estate - Development,"DLF Ltd with its subsidiaries, associates and JVs is engaged in real estate development, from the identification and acquisition of land to planning, execution, construction and marketing of projects. It is also engaged in business of leasing, generation of power, provision of maintenance services, hospitality and recreational services which are related to the overall development of real estate business.",screener
DLINKINDIA,D-Link India Ltd,Technology,Communication Equipment,D-Link (India) Ltd is primarily engaged in marketing and distribution of networking products. It operates through a distribution network with a wide range of product portfolio and solutions with a nationwide reach across India.,screener
DMART,Avenue Supermarts Ltd,Consumer Defensive,Discount Stores,"Avenue Supermarts Limited (DMart) is a national supermarket chain, with a focus on value-retailing. We offer a wide range of products with a focus on the Foods, Non-Foods (FMCG) and General Merchandise & Apparel product categories.",screener
DMCC,DMCC Speciality Chemicals Ltd,Basic Materials,Chemicals,"Incorporated in 1919, DMCC Speciality Chemicals Ltd manufactures and sells Commodity and Speciality Chemicals",screener
DNAMEDIA,Diligent Media Corporation Ltd,Communication Services,Publishing,"Diligent Media Corp. Ltd is engaged in the printing and publication of newspapers, magazines, books, inserts, and annual reports. It also publishes online newspaper.",screener
DODLA,Dodla Dairy Ltd,Consumer Defensive,Food Distribution,"Incorporated in the year 1995, Dodla Dairy Limited is an integrated dairy company based in Telangana. The company derives the majority of its revenue from the sale of Milk and dairy-based value added products in the branded consumer Market. Currently, its procurement is centered in 5 states and its products are available for purchase in 11 states. It has 94 milk chilling centers. Some of their plants are ISO 22000:2005 Certified while two are ISO 50001:2011 (EnMS) Certified.",screener
DOLATALGO,Dolat Algotech Ltd,Financial Services,Capital Markets,Dolat Algotech Ltd is a trading cum clearing member of NSE India and carries on the business of securities broking and securities trading.,screener
DOLLAR,Dollar Industries Ltd,Consumer Cyclical,Apparel Manufacturing,"Dollar Industries Limited is engaged in manufacture and sale of hosiery products in knitted inner wears, casual wears and thermal wears.",screener
DOLPHIN,Dolphin Offshore Enterprises (India) Ltd,Energy,Oil & Gas Equipment & Services,"Incorporated in 1979, Dolphin Offshore Enterprises Ltd providing services to the offshore oil and gas industry",screener
DOMS,DOMS Industries Ltd,Industrials,Business Equipment & Supplies,"Incorporated in 2006, DOMS Industries Limited is a stationery and art product company primarily engaged in designing, developing, manufacturing, and selling a wide range of these products under the flagship brand, DOMS.",screener
DONEAR,Donear Industries Ltd,Consumer Cyclical,Textile Manufacturing,"Incorporated in 1987, Donear Industries Ltd manufactures Textiles and deals in Rental Property",screener
DPABHUSHAN,D.P. Abhushan Ltd,Consumer Cyclical,Luxury Goods,"D. P. Abhushan Limited is engaged in the business of manufacturing, selling, and trading Jewellery and other precious Metals. It is also engaged in the business of Power generation through Windmill. Famous Jewellery store in Ratlam (M.P) Three more stores fully operational in Indore, Bhopal & Udaipur.",screener
DPSCLTD,India Power Corporation Ltd,Utilities,Utilities - Regulated Electric,"Incorporated in 1919, India Power Corporation Ltd is engaged in business of Power Distribution, Renewable Power Generation and Smart Grid.",screener
DPWIRES,D P Wires Ltd,Industrials,Metal Fabrication,"Incorporated in 1998, D P Wires Ltd is in the business of manufacturing Steel Wires, Plastic Products, Laying of Plastic Films, and acting as Commission Agent and Generation of Power through Wind Mill",screener
DRAGARWQ,Dr Agarwals Eye Hospital Ltd,,,Dr Agarwal's Eye Hospital Ltd is a leading chain of eye hospitals with predominant presence in Tamil Nadu.,screener
DRCSYSTEMS,DRC Systems India Ltd,Technology,Information Technology Services,"Incorporated in 2012, DRC Systems India Ltd is an IT services and Consultancy company",screener
DREAMFOLKS,Dreamfolks Services Ltd,Industrials,Airports & Air Services,"Incorporated on April 24, 2008, DreamFolks Services Ltd is India's largest airport service aggregator platform facilitating an enhanced airport experience to passengers leveraging a technology-driven platform.",screener
DREDGECORP,Dredging Corporation of India Ltd,Industrials,Engineering & Construction,"Dredging Corporation of India Limited (DCI) is engaged in providing integrated dredging services to ports, Indian Navy and other maritime organizations in India.",screener
DRREDDY,Dr Reddys Laboratories Ltd,Healthcare,Drug Manufacturers - Specialty & Generic,"Dr. Reddy's Laboratories Ltd is a leading India-based pharmaceutical company which offers a portfolio of products and services, including Active Pharmaceutical Ingredients (APIs), Custom Pharmaceutical services (CPS), generics, biosimilars and differentiated formulations.",screener
DSFCL,DCM SHRIRAM FINE CHEM LTD,Basic Materials,Specialty Chemicals,"DCM Shriram Fine Chemicals Limited engages in producing, contract manufacturing, and selling of chemicals and their by-products. Its Pharma products includes D (-) alpha phenyl glycine base, D (-) alpha phenyl glycine ethyl potassium dane salt, D (-) alpha phenyl glycine chloride hydrochloride, D (-) para hydroxy phenyl glycine base, D (-) para hydroxy phenyl glycine methyl potassium dane salt, D (-) para hydroxy phenyl glycine methyl ester, DL 2-(2-Chloro Phenyl) glycine, valine hydantoin, sodium phenoxy acetate, phenoxy acetic acid, phenyl acetic acid, potassium phenyl acetate, sodium phenyl acetate, benzaldehyde, benzyl chloride, benzyl acohol, benzyl benzoate, benzyl cyanide, ortho chloro benzaldehyde, ortho chloro benzoic acid, ortho chloro benzyl cyanide, ortho chloro phenyl acetic acid, para chloro benzaldehyde, para chloro benzoic acid, para chloro benzyl cyanide, and D(-) phenyl glycine methyl ester hydrochloride; Agrochemical products include benzaldehyde, benzyl Chloride, ortho chloro benzaldehyde, ortho chloro benzoic acid, ortho chloro benzyl cyanide, para chloro benzaldehyde, para chloro benzoic acid, para chloro benzyl cyanide, and para chloro phenyl glycine; Fragrance/Perfumery products include sodium phenoxy acetate, phenoxy acetic acid, phenyl acetic acid, potassium phenyl acetate, sodium phenyl acetate, benzaldehyde, benzyl alcohol, benzyl benzoate, and di-benzyl ether; Dyes/Paints/Coatings products include benzaldehyde, benzyl alcohol, ortho chloro benzaldehyde, and para chloro benzaldehyde.; and Other products include sodium benzoate, di-benzyl ether, sodium sulphate, ammonium sulphate, phosphoric acid, sodium nitrate, and hydrochloric acid. The company was incorporated in 2021 and is based in New Delhi, India. DCM Shriram Fine Chemicals Limited operates as a subsidiary of DCM Shriram Industries Limited.",yfinance
DSSL,Dynacons Systems & Solutions Ltd,Technology,Information Technology Services,"Incorporated in 1995, Dynacons Ltd provides IT infrastructure-related activities",screener
DTIL,Dhunseri Tea & Industries Ltd,Consumer Defensive,Packaged Foods,"Incorporated in 1989, Dhunseri Tea & Industries Ltd is into cultivation, manufacture and sale of tea and macadamia nuts",screener
DUCON,Ducon Infratechnologies Ltd,Industrials,Specialty Industrial Machinery,"Incorporated in 2005, Ducon Infratechnologies Ltd is in Engineering, Procurement and Construction business",screener
DVL,Dhunseri Ventures Ltd,Financial Services,Capital Markets,"Incorporated in 1916, Dhunseri Ventures Ltd is in the business of Treasury Operations and Trading activities",screener
DWARKESH,Dwarikesh Sugar Industries Ltd,Consumer Defensive,Confectioners,"Dwarikesh Sugar Industries Ltd is primarily engaged in manufacturing of sugar and allied products. It has strong presence in fields such as sugar manufacturing, power and ethanol/ industrial alcohol production. It is also a bio-energy company with supporting businesses of sugar manufacture and power co-generation.",screener
DYCL,Dynamic Cables Ltd,Industrials,Electrical Equipment & Parts,"Dynamic Cables Ltd. is a manufacturer of power infra cables that includes LT, HT, EHVC, Power control & instrumentation cables, flexible & industrial cables, solar cables and railway signaling cables. It supplies cables to Government Discom, Private Distribution companies, Private EPC contractors, industrial and Export clients. Co. has 3 manufacturing plants situated at Jaipur and Reengus. Business operations are managed through a corporate office in Jaipur and 5 regional sales offices across India.",screener
DYNAMATECH,Dynamatic Technologies Ltd,Consumer Cyclical,Auto Parts,"Incorporated in 1973, DTL is into manufacturing of hydraulic gear pumps and automotive turbochargers. They serve clients across Aerospace, automotive and hydraulic industries. DTL has manufacturing facilities in Europe and India serving customers across 6 continents.",screener
DYNPRO,Dynemic Products Ltd,Basic Materials,Specialty Chemicals,"Incorporated in 1990, Dynemic Products is in the business of manufacturing and selling of Dyes & Dye Intermediates",screener
E2E,E2E Networks Ltd,Technology,Software - Infrastructure,"E2E Networks is an Nse-listed AI-focused hyper scale cloud platform, offering advanced cloud GPUs and a comprehensive ecosystem of cloud technologies designed for the development and deployment of AI/ML applications.",screener
EASEMYTRIP,Easy Trip Planners Ltd,Consumer Cyclical,Travel Services,The company offers a comprehensive range of travel - related products and services under the flagship brand ''Ease My Trip''.,screener
EASTSILK,Eastern Silk Industries Ltd,Consumer Cyclical,Textile Manufacturing,"Incorporated in 1946, Eastern Silks Ltd manufactures silk fabrics and other related textile products",screener
EBGNG,GNG Electronics Ltd,Technology,Computer Hardware,"Incorporated in 2006, GNG Electronics Limited offers refurbishing services for laptops, desktops, and ICT Devices, both globally and in India.",screener
ECLERX,eClerx Services Ltd,Technology,Information Technology Services,"EClerx Services Ltd incorporated in 2000, provides business process management, automation and analytics services to a number of Fortune 2000 enterprises, including some of the world's leading financial services, communications, retail, fashion, media & entertainment, manufacturing, travel & leisure and technology companies",screener
ECOSMOBLTY,Ecos (India) Mobility & Hospitality Ltd,Industrials,Rental & Leasing Services,"Incorporated in February 1996, ECOS (India) Mobility & Hospitality Limited provides car rental service in India.",screener
EDELWEISS,Edelweiss Financial Services Ltd,Financial Services,Financial Conglomerates,"Incorporated in 1995, Edelweiss Financial Services Ltd provides Investment Banking and Advisory Services and holding company activities",screener
EFCIL,EFC (I) Ltd,Real Estate,Real Estate Services,"Incorporated in 1984, EFC (I) Ltd (formerly Amani Trading and Exports Ltd) is in the business of leasing Offices spaces",screener
EICHERMOT,Eicher Motors Ltd,Consumer Cyclical,Auto Manufacturers,"Eicher Motors Limited, incorporated in 1982, is the listed company of the Eicher Group in India and a leading player in the Indian automobile industry and the global leader in middleweight motorcycles. Eicher has a joint venture with Sweden’s AB Volvo to create Volvo Eicher Commercial Vehicles Limited (VECV). VECV is engaged in truck and bus operations, auto components business, and technical consulting services business",screener
EIDPARRY,EID Parry (India) Ltd,Basic Materials,Agricultural Inputs,"EID Parry is engaged in Sugar, Nutraceuticals and ethanol production. It also has a significant presence in the Farm Inputs business including Bio pesticides through its subsidiary, Coromandel International Limited.",screener
EIEL,Enviro Infra Engineers Ltd,Industrials,Engineering & Construction,"Established in 2009, Enviro Infra Engineers is engaged in the design, construction, operation, and maintenance of water and Waste-Water Treatment Plants (WWTPs) and water supply projects (WSSPs) for government agencies/entities.",screener
EIFFL,Euro India Fresh Foods Ltd,Consumer Defensive,Packaged Foods,"Incorporated in 2012, Euro India Fresh Foods Ltd manufacturing and selling of processed food and beverages",screener
EIHAHOTELS,EIH Associated Hotels Ltd,Consumer Cyclical,Lodging,EIH Associated Hotels Ltd is primarily engaged in owning premium luxury hotels under the luxury 'Oberoi' and five-star 'Trident' brands.,screener
EIHOTEL,EIH Ltd,Consumer Cyclical,Lodging,"EIH is primarily engaged in owning and managing premium luxury hotels and cruisers under the luxury Oberoi, Trident and Maidens brands. The Company is also engaged in flight catering, airport restaurants, project management and corporate air charters.(Source : 202003 Annual Report Page No:124)",screener
EIMCOELECO,Eimco Elecon (India) Ltd,Industrials,Farm & Heavy Construction Machinery,"Eimco Elecon (India) Limited, incorporated in 1974, is in the business of Manufacturing and Marketing Equipment for Underground and Opencast mines. The Co is situated at Vallabh Vidyanagar, Gujarat. It was the first Co. to introduce the intermediate technology of Side Dump Loaders, Load Haul Dumpers and Rocker Shovel Loaders in India.",screener
EKC,Everest Kanto Cylinder Ltd,Industrials,Specialty Industrial Machinery,"Everest Kanto Cylinder Ltd (EKC) is engaged in the manufacture of high-pressure seamless gas cylinders along with other cylinders and equipments used for containing and storage of natural gas, liquids and air.",screener
ELANTAS,Elantas Beck India Ltd,Basic Materials,Specialty Chemicals,"ELANTAS Beck India Limited is engaged in manufacturing a wide range of specialty chemicals in the electrical insulation and construction industries. It is a part of ALTANA, an international specialty chemicals group.",screener
ELCIDIN,Elcid Investments Ltd,,,"Incorporated in 1981, Elcid Investments Ltd is a non-banking financial company (NBFC) registered with the Reserve Bank of India (RBI) under the category of Investment Company. Its business is to make investments in shares, debentures, mutual funds etc.",screener
ELDEHSG,Eldeco Housing & Industries Ltd,Real Estate,Real Estate Services,"Incorporated in 1985, Eldeco Housing and Industries Ltd develops real estate properties for residential, commercial and retail purposes",screener
ELECON,Elecon Engineering Company Ltd,Industrials,Specialty Industrial Machinery,"Elecon Engineering Company Ltd., incorporated in 1960. Company manufactures and sells power transmission and material handling equipment in India and internationally. In addition, it engages in the steel and non-ferrous foundry business.",screener
ELECTCAST,Electrosteel Castings Ltd,Industrials,Building Products & Equipment,"Electrosteel Castings is engaged in the business of manufacturing Ductile Iron (DI) Pipes, Ductile Iron Fittings (DIF), Cast Iron (CI) Pipes and produces and supplies Pig Iron.",screener
ELECTHERM,Electrotherm (India) Ltd,Basic Materials,Steel,"Incorporated in 1983, Electrotherm Ltd is in the business of Engineering & Technologies, Special Steel and Electric Vehicles",screener
ELGIEQUIP,Elgi Equipments Ltd,Industrials,Specialty Industrial Machinery,"Incorporated in 1960, Elgi Equipments Limited along with its subsidiaries, is in the business of manufacturing and supplying Air Compressors ** & Automotive Equipments**. It is also providing related after sales services",screener
ELGIRUBCO,Elgi Rubber Company Ltd,Consumer Cyclical,Auto Parts,"Incorporated in 1981, ELGI Rubber Ltd is in the business of manufacture of Reclaimed rubber, Retreading machinery, and Retread rubber",screener
ELIN,Elin Electronics Ltd,Industrials,Electrical Equipment & Parts,"Incorporated in 1982, Elin Electronics Ltd is in the business of Electronics Manufacturing Services",screener
ELITECON,Elitecon International Ltd,,,"Incorporated in 1987, Elitecon International Ltd is in the business of tobacco and allied products",screener
ELLEN,Ellenbarrie Industrial Gases Ltd,Basic Materials,Chemicals,"Ellenbarrie Industrial Gases Ltd. is engaged in the business of oxygen and nitrogen. The Company is a manufacturer and supplier of industrial gases in the eastern and southern India, both in bulk and packaged form. It is engaged in the medical, chemical, construction, defense and energy businesses.",screener
ELPROINTL,Elpro International Ltd,,,"Elpro International Limited is engaged in manufacturing surge arresters, construction and development of real estate properties, equity investment in third parties and windmill operations.",screener
EMAMILTD,Emami Ltd,Consumer Defensive,Household & Personal Products,"Emami is engaged in manufacturing & marketing of personal care & healthcare products with an enviable portfolio of household brand names such as BoroPlus, Navratna, Fair and Handsome, Zandu Balm, Kesh King, Zandu Pancharishta, Mentho Plus Balm and others.(Source : 201903 Annual Report Page No: 193)",screener
EMAMIPAP,Emami Paper Mills Ltd,Basic Materials,Paper & Paper Products,"Incorporated in 1981, Emami Paper Mills Ltd manufactures writing and printing paper, newsprint, and also packaging boards",screener
EMAMIREAL,Emami Realty Ltd,Real Estate,Real Estate - Development,"Incorporated in 2006, Emami Realty Ltd is in the business of real estate development",screener
EMBDL,Embassy Developments Ltd,Real Estate,Real Estate - Diversified,"Incorporated in 2006, Embassy Developments Ltd is a real estate developer of residential, commercial, and SEZ projects.",screener
EMCURE,Emcure Pharmaceuticals Ltd,Healthcare,Drug Manufacturers - Specialty & Generic,"Incorporated in 1981, Emcure Pharmaceuticals Ltd manufactures and markets pharmaceutical products globally",screener
EMIL,Electronics Mart India Ltd,Consumer Cyclical,Specialty Retail,"Incorporated in 1980, Electronics Mart India Limited is the 4th largest consumer durable and electronics retailer in India. The company offers a diversified range of products with a focus on large appliances (air conditioners, televisions, washing machines, and refrigerators), mobiles and small appliances, IT, and others. The company's offering includes more than 6,000 SKUs (stock keeping units) across product categories from more than 70 consumer durable and electronic brands.",screener
EMKAY,Emkay Global Financial Services Ltd,Financial Services,Capital Markets,"Incorporated in 1995, Emkay Global Financial Services Ltd is in the business of providing capital market services",screener
EMMBI,Emmbi Industries Ltd,Consumer Cyclical,Packaging & Containers,"Incorporated in 1994, Emmbi Industries Ltd manufactures HDPE & PP - Woven Polymer based products",screener
EMMVEE,Emmvee Photovoltaic Power Ltd,Technology,Solar,"Incorporated in March 2007, Emmvee Photovoltaic Power Limited is an integrated solar PV module and cell manufacturer.",screener
EMPOWER,Empower India Ltd,,,"Incorporated in 1981, Empower India Ltd is in the business of high end IT products",screener
EMSLIMITED,EMS Ltd,Industrials,Engineering & Construction,"EMS Limited is a multi-disciplinary EPC company, headquartered in Delhi that specializes in providing turnkey services in water and wastewater collection, treatment and disposal. EMS provides complete, single-source services from engineering and design to construction and installation of water, wastewater and domestic waste treatment facilities.",screener
EMUDHRA,eMudhra Ltd,Technology,Software - Application,"Emudhra is a licensed certifying authority involved in issuing digital signature certificates in India under its eMudhra brand. The company is licensed by the Controller of Certifying Authorities (CCA), Ministry of Information Technology, and operates under the guidelines set by the Information technology Act.",screener
ENDURANCE,Endurance Technologies Ltd,Consumer Cyclical,Auto Parts,"Endurance Technologies is engaged in the business of manufacturing and selling of aluminium die casting (including alloy wheel), suspension, transmission, braking and embedded electronic products with operations spread across India and Europe with 19 plants in India and 14 in Europe.",screener
ENERGYDEV,Energy Development Company Ltd,Utilities,Utilities - Regulated Electric,"Incorporated in 1995, Energy Development Company Ltd does generation and sale of bulk power and trading of power equipments",screener
ENGINERSIN,Engineers India Ltd,Industrials,Engineering & Construction,EIL is a CPSU with majority ownership of the GoI operating under the administrative control of MoPNG. The Co. provides consultancy and engineering services and undertakes turnkey contracts.,screener
ENIL,Entertainment Network (India) Ltd,Communication Services,Broadcasting,"Incorporated in 1999, Entertainment Network (India) Ltd operates FM radio broadcasting stations",screener
ENRIN,Siemens Energy India Ltd,Utilities,Utilities - Renewable,"Incorporated in 2024, Siemens Energy India Ltd is a leading energy technology Provider, delivering integrated solutions across power generation and transmission systemsSiemens Energy India Limited (SEIL) works with its customers and partners on energy systems for the future, thus supporting the transition to a more sustainable world. With its portfolio of products, solutions and services, it covers almost the entire energy value chain - from power and heat generation and transmission to storage.",screener
ENTERO,Entero Healthcare Solutions Ltd,Healthcare,Medical Distribution,"Incorporated in 2018, Entero Healthcare Solutions Ltd is in the business of distribution and marketing of pharmaceutical and surgical products and allied services",screener
EPACK,Epack Durable Ltd,Consumer Cyclical,"Furnishings, Fixtures & Appliances","Incorporated in 2019, EPACK Durable Limited is an Original Design Manufacturer (ODM) of room air conditioners (RAC).",screener
EPACKPEB,EPack Prefab Technologies Ltd,Industrials,Engineering & Construction,"Incorporated in February 1999, Epack Prefab Technologies Limited is one of India’s leading players in the pre-engineered building (PEB) and prefabricated construction industry.",screener
EPIGRAL,Epigral Ltd,Basic Materials,Chemicals,"Epigral Limited, formerly known as Meghmani Finechem Ltd, incorporated in 2007, is a leading integrated manufacturer of chemicals.",screener
EPL,EPL Ltd,Consumer Cyclical,Packaging & Containers,"EPL Limited (formerly known as Essel Propack Limited),is the largest specialty packaging global company, manufacturing laminated plastic tubes catering to the Beauty & Cosmetics, Pharma & Health, Food, Oral and Home.",screener
EQUIPPP,Equippp Social Impact Technologies Ltd,Technology,Information Technology Services,"Incorporated in 2022, EquiPPP Social Impact Technologies Ltd provides new age technologies and next generation IT solutions & services",screener
EQUITASBNK,Equitas Small Finance Bank Ltd,Financial Services,Banks - Regional,"Equitas Small Finance Bank Ltd before acquiring small bank license, operated as a wholly-owned subsidiary of Equitas Holding Ltd. The holding entity started its operations in 2007 in the microfinance segment & diversified into vehicle & housing finance in 2011. Also entered into SME & LAP in 2013. It merged with the other two subsidiaries named Equitas Microfinance Ltd & Equitas Housing Finance Ltd & formed a bank. After receiving a license in Sept 2016 the company commenced operations under Equitas small finance Bank.",screener
