ticker,name,sector,industry,description,source
JYOTHYLAB,Jyothy Labs Ltd,Consumer Defensive,Household & Personal Products,"Jyothy Labs Limited was founded in 1983 by Mr. M. P. Ramachandran in Thrissur, Kerala. JLL is renowned brand in the domestic FMCG industry.It has a diversified product portfolio spanning four major categories of fabric care, dishwashing, household insecticides (HI) and personal care and an established market position in the post-wash (under Ujala brand) and the dishwashing segments (under Pril and Exo brands).",screener
JYOTICNC,Jyoti CNC Automation Ltd,Industrials,Specialty Industrial Machinery,"Jyoti CNC Automation is a leading manufacturer of simultaneous 5-axis CNC machines in India, with a 10% market share in the country. It has years of expertise in designing & manufacturing tools for companies in Aerospace, Defence, Auto Components, General Engineering and other industries.",screener
JYOTISTRUC,Jyoti Structures Ltd,Industrials,Specialty Industrial Machinery,"Jyoti Structures Limited was incorporated in 1974. The company is engaged in Electricity, transmission, distribution and substation. The registered office of the Company is in Mumbai.",screener
KABRAEXTRU,Kabra Extrusion Technik Ltd,Industrials,Specialty Industrial Machinery,Kabra Extrusiontechnik Limited was incorporated in 1982. It is part of the Kolsite group and operates in the business of plastic extrusion machinery. KET specializes in providing plastic extrusion machinery for manufacturing pipes and films. It has two manufacturing locations in Daman. Co. has also started Lithium ion battery packs business from FY21,screener
KAJARIACER,Kajaria Ceramics Ltd,Industrials,Building Products & Equipment,Kajaria Ceramics Ltd is primarily engaged in manufacturing and trading of ceramic and vitrified tiles in India. It is the largest manufacturer of ceramic/ vitrified tiles in India and 8th largest in the world.,screener
KAKATCEM,Kakatiya Cement Sugar & Industries Ltd,Basic Materials,Building Materials,"Incorporated in 1979, Kakatiya Cement Sugar & Industries Ltd deals in all kinds of Portland Cement, sugar, generation and distribution of power",screener
KALAMANDIR,Sai Silks (Kalamandir) Ltd,Consumer Cyclical,Apparel Retail,"Incorporated in 2005, Sai Silks (Kalamandir) Limited provides ethnic apparel and value-fashion products through its four store formats - ‘Kalamandir‘, ‘VaraMahalakshmi Silks‘, ‘Mandir‘ and ‘KLM Fashion Mall''.",screener
KALPATARU,Kalpataru Ltd,Real Estate,Real Estate - Development,"Founded in 1988, Kalpataru Limited is a real estate development company based in Mumbai, Maharashtra.",screener
KALYANI,Kalyani Commercials Ltd,Consumer Cyclical,Auto & Truck Dealerships,"Incorporated in 1985, Kalyani Commercials Ltd deals in trading of heavy commercial vehicles and servicing petroleum dealership",screener
KALYANIFRG,Kalyani Forge Ltd,Consumer Cyclical,Auto Parts,"Incorporated in 1979, Kalyani Forge Ltd manufactures high-quality, hot-warm and cold-forged products",screener
KALYANKJIL,Kalyan Jewellers India Ltd,Consumer Cyclical,Luxury Goods,"Kalyan Jewellers India Ltd. designs manufacture and sells a range of gold, studded and other jewellery products across various price points. It is one of the largest jewellery retailers in India based on revenue as of FY20. The co. was founded by the current Chairman, MD and Promoter, Mr T.S. Kalyanaraman",screener
KAMAHOLD,Kama Holdings Ltd,,,"KAMA Holdings Ltd is a core investment company while the principal activities of its subsidiaries are manufacturing, purchasing, and sale of technical textiles, chemicals, packaging films, and other polymers.",screener
KAMATHOTEL,Kamat Hotels (India) Ltd,Consumer Cyclical,Lodging,"Kamat Hotels India Ltd is one of the companies of the Kamats Group. KHIL is engaged in the Hospitality business and other related services like hotel consultancy, setup, etc…",screener
KAMDHENU,Kamdhenu Ltd,Basic Materials,Steel,"Incorporated in 1994, Kamdhenu Ltd is into manufacture, marketing, and distribution of TMT Bars, structural steel and allied products",screener
KAMOPAINTS,Kamdhenu Ventures Ltd,Basic Materials,Steel,"Incorporated in 1995, Kamdhenu Ventures Ltd manufactures and sells wide range of paints",screener
KANANIIND,Kanani Industries Ltd,Consumer Cyclical,Luxury Goods,"Incorporated in 1983, Kanani Industries Ltd manufactures & exports Diamond Studded Jewellery.",screener
KANCHI,Kanchi Karpooram Ltd,,,"Incorporated in 1992, Kanchi Karpooram Ltd manufactures Camphor and Allied Products and trades in in Agro Products",screener
KANORICHEM,Kanoria Chemicals & Industries Ltd,Basic Materials,Chemicals,"Incorporated in 1960, Kanoria Chemicals & Industries Ltd is in the business of manufacturing Industrial Chemicals",screener
KANPRPLA,Kanpur Plastipack Ltd,Consumer Cyclical,Packaging & Containers,"Incorporated in 1971, Kanpur Plastipack Ltd manufactures HDPE /PP Woven Sacks, PP Box Bags, FIBC, Fabrics and High Tenacity PP MFY",screener
KANSAINER,Kansai Nerolac Paints Ltd,Basic Materials,Specialty Chemicals,"Having started its operations in 1920 as Gahagan Paints & Varnish in Mumbai, Kansai Nerolac Paints is principally engaged in the manufacturing of Paints and is a market leader in Industrial coatings.",screener
KAPSTON,Kapston Services Ltd,Industrials,Specialty Business Services,"Incorporated in 2009, Kapston Services Ltd provides Facility Management & staffing services",screener
KARMAENG,Karma Energy Ltd,Utilities,Utilities - Renewable,"Incorporated in 2007, Karma Energy Ltd is engaged in the generation of power from renewable sources like Wind.",screener
KARURVYSYA,Karur Vysya Bank Ltd,Financial Services,Banks - Regional,Karur Vysya Bank is engaged in providing a wide range of banking and financial services including commercial banking and treasury operations.,screener
KAUSHALYA,Kaushalya Infrastructure Development Corpn Ltd,Industrials,Engineering & Construction,"Incorporated in 1992, Kaushalya Infrastructure Development Corporation is in the business of construction contracts for Infrastructure and Hotel",screener
KAVDEFENCE,Kavveri Defence & Wireless Technologies Ltd,Technology,Communication Equipment,"Incorporated in 1996, Kavveri Defence & Wireless Technologies Ltd is engaged in the design and development, and manufacture of RF products and Antennas",screener
KAYA,Kaya Ltd,Consumer Defensive,Household & Personal Products,"Incorporated in 2003, Kaya Ltd provides Skin and Hair care products & services",screener
KAYNES,Kaynes Technology India Ltd,Technology,Electronic Components,"Incorporated in 2008, Kaynes Technology is a leading end-to-end and IoT solutions-enabled integrated electronics manufacturing company. The company provides conceptual design, process engineering, integrated manufacturing, and life-cycle support for major players in the automotive, industrial, aerospace and defense, outer-space, nuclear, medical, railways, Internet of Things (""IoT""), Information Technology (""IT"") and other segments.",screener
KCP,K C P Ltd,Basic Materials,Building Materials,"KCP Ltd is engaged in the business of manufacture and sale of cement, sugar, heavy engineering, power generation for captive use and hospitality.",screener
KCPSUGIND,KCP Sugar & Industries Corporation Ltd,Consumer Defensive,Confectioners,"Incorporated in 1995, K.C.P Sugar and Industries Corporation Ltd is in the sugar manufacturing and allied businesses",screener
KDDL,KDDL Ltd,Consumer Cyclical,Luxury Goods,"Incorporated in 1981, KDDL manufactures watch components like dials, hands and precision engineering goods under the brand name, Eigen.",screener
KEC,KEC International Ltd,Industrials,Engineering & Construction,"KEC International is a global infrastructure EPC major. It has presence in the verticals of Power Transmission and Distribution, Railways, Civil, Urban Infrastructure, Solar, Oil & Gas Pipelines, and Cables. It is the flagship Company of the RPG Group.",screener
KECL,Kirloskar Electric Company Ltd,Industrials,Specialty Industrial Machinery,"Incorporated in 1946, Kirloskar Electric Company Ltd manufactures and sells electric motors, alternators, generators, transformers, switchgear, DG sets, etc.",screener
KEEPLEARN,DSJ Keep Learning Ltd,Consumer Defensive,Education & Training Services,"Incorporated in 1989, DSJ Keep Learning Ltd provides support services and software solutions to educational institutions.",screener
KEI,KEI Industries Ltd,Industrials,Electrical Equipment & Parts,"Incorporated in 1968, KEI Industries Ltd manufactures wires and cables (W&C) like EHV cables, HT cables, LT cables, and sells them in India and overseas",screener
KELLTONTEC,Kellton Tech Solutions Ltd,Technology,Software - Application,"Kellton Tech Solutions Ltd offers services in digital transformation, ERP and other IT services. It has operations across US, Europe, India and Asia-Pacific with a team of ~1,800 employees.",screener
KENNAMET,Kennametal India Ltd,Industrials,Tools & Accessories,"Kennametal India Ltd was incorporated in 1938, it is a 75% subsidiary of Kennametal Inc. It manufactures carbide tools and special-purpose machines for automotive, defense, railways, infrastructure and General engineering segments. The manufacturing unit is in Bengaluru.",screener
KERNEX,Kernex Microsystems (India) Ltd,Technology,Software - Application,"Incorporated in 1991, Kernex Microsystems Ltd manufactures and sells Safety Systems and Software services for Railways",screener
KESORAMIND,Kesoram Industries Ltd,Basic Materials,Building Materials,"Kesoram Industries Limited is a flagship company of B. K. Birla group. The Co is engaged in the manufacturing of Cement and Rayon, TP & Chemicals.",screener
KEYFINSERV,Keynote Financial Services Ltd,Financial Services,Capital Markets,"Incorporated in 1993, Keynote Financial Services Ltd is in the business of Investment banking, Corporate advisory, ESOP advisory, etc.",screener
KFINTECH,KFin Technologies Ltd,Technology,Software - Application,"KFin Technologies Limited is a leading technology-driven financial services platform. The company provides services and solutions to asset managers and corporate issuers across asset classes in India and provides several investor solutions including transaction origination and processing for mutual funds and private retirement schemes in Malaysia, the Philippines and Hong Kong.",screener
KHADIM,Khadim India Ltd,Consumer Cyclical,Footwear & Accessories,"Incorporated in 1981, Khadim India Ltd is in manufacturing / retail business of footwear and accessories",screener
KHAICHEM,Khaitan Chemicals & Fertilizers Ltd,Basic Materials,Agricultural Inputs,"Incorporated in 1982, Khaitan Chemicals & Fertilizers Ltd is a manufacture of Single Super Phosphate (Fertilizer), Sulphuric Acid and other chemicals",screener
KHAITANLTD,Khaitan (India) Ltd,Industrials,Industrial Distribution,"Incorporated in 1936, Khaitan (India) Ltd is engaged in trading of electrical goods and has presence in agriculture and sugar sectors",screener
KHANDSE,Khandwala Securities Ltd,Financial Services,Capital Markets,"Incorporated in 1993, Khandwala Securities Ltd is in the business of offering capital market services.",screener
KICL,Kalyani Investment Company Ltd,Financial Services,Asset Management,"Kalyani Investment Co. Ltd. is a part of the Kalyani Group and is a Core Investment Company holding more than 60% of its net assets in the form of investments in equity shares of Group Companies, while more than 90% of its net assets in the form of investments in equity/preference shares of or debentures/debts in Group Companies.",screener
KILITCH,Kilitch Drugs (India) Ltd,Healthcare,Drug Manufacturers - Specialty & Generic,"Incorporated in 1978, Kilitch Drugs Ltd is engaged in the operation and management of Pharmaceutical Products",screener
KIMS,Krishna Institute of Medical Sciences Ltd,Healthcare,Medical Care Facilities,"Krishna Medical Institution Ltd (KIMS) was Incorporated in the year 1973 and is one of the largest corporate healthcare groups in Andhra Pradesh and Telangana in terms of patients treated and treatments offered. The company offers multidisciplinary healthcare services with primary, secondary, and tertiary care across 2-3 tier cities and an additional quaternary healthcare facility in tier-1 cities.",screener
KINGFA,Kingfa Science & Technology (India) Ltd,Basic Materials,Specialty Chemicals,"Kingfa Science & Technology (India) Limited, a subsidiary company of M/s Kingfa Science & Technology Co. Ltd China, is engaged in the business of manufacturing and supply of high-quality modified plastic compounds for automotive and consumer products and personal protective equipments like masks and gloves.",screener
KIOCL,KIOCL Ltd,Basic Materials,Steel,"KIOCL is a flagship company under the Ministry of Steel, GoI, with Miniratna status. It is an export-oriented unit with expertise in iron ore mining, filtration technology, and the production of high-quality pellets.",screener
KIRANVYPAR,Kiran Vyapar Ltd,,,"Incorporated in 1995, Kiran Vyapar Ltd is in the business of providing loans and making investments in shares and securities",screener
KIRIINDUS,Kiri Industries Ltd,Basic Materials,Specialty Chemicals,"Kiri Industries Limited (KIL) is engaged in the business of manufacturing and exporting a wide range of Dyes, Dye Intermediates, and Basic Chemicals from India.",screener
KIRLFER,Kirloskar Ferrous Industries Ltd,Industrials,Metal Fabrication,"KFIL, incorporated in 1991, is a part of the Pune-based Kirloskar Group. KFIL manufactures pig iron and ferrous castings such as cylinder blocks, cylinder heads, and transmission parts and different types of housings required by automobile, tractor and diesel engine industries. It is one of the leading players in foundry-grade pig iron manufacturing and ferrous castings in the domestic market.",screener
KIRLOSBROS,Kirloskar Brothers Ltd,Industrials,Specialty Industrial Machinery,"Kirloskar Brothers is a part of the Kirloskar Group engaged in the business of engineering and manufacturing of systems for fluid management. The core businesses include large infrastructure projects (Water Supply, Power Plants, and Irrigation), Pumps, Valves, Motors and Hydro turbines.",screener
KIRLOSENG,Kirloskar Oil Engines Ltd,Industrials,Specialty Industrial Machinery,"KOEL, one of the flagship companies of the Kirloskar group, manufactures and services diesel engines and diesel generator sets. The company also makes diesel, petrol and kerosene-based pump sets. It has manufacturing units in Pune, Kagal, and Nashik. The company caters to the agriculture, power generation, and industrial sectors.",screener
KIRLOSIND,Kirloskar Industries Ltd,Industrials,Metal Fabrication,"Kirloskar Ind is engaged in the business of Iron castings, Investments (Securities and Properties), Wind power generation and real estate. The Company owns lands, buildings, apartments and offices in Pune, New Delhi and Jaipur. The Co. has given most of these lands, buildings and offices on a lease and license basis to the group and other companies.",screener
KIRLPNU,Kirloskar Pneumatic Company Ltd,Industrials,Specialty Industrial Machinery,"Kirloskar Pneumatic Company Ltd, incorporated in 1958, is part of the Pune-based Kirloskar group. The Co. is engaged in the business of Compression & Transmission segments. It also undertakes O&M services for Compression Packages and has also entered logistic services by operating RoadRailer trains for end to end transportation of goods. It serves a variety of sectors like Oil & Gas, Steel, Cement, Food & Beverages, Railways, Marine and other industries.",screener
KISSHT,Onemi Technology Solutions Ltd,Financial Services,Credit Services,"Incorporated in 2016, OnEMI Technology Solutions Limited is a technology-enabled lender in India, primarily offering digital loans through its mobile application for various consumption and business needs.",screener
KITEX,Kitex Garments Ltd,Consumer Cyclical,Apparel Manufacturing,Kitex Garments Limited was incorporated in 1992 and is promoted by Mr. Sabu M Jacob. The company exports cotton and organic cotton garments especially infant wear to US and European markets,screener
KKCL,Kewal Kiran Clothing Ltd,Consumer Cyclical,Apparel Manufacturing,"Kewal Kiran Clothing Limited was incorporated in 1992. The Company is engaged in manufacturing, marketing and retailing of branded readymade garments and finished accessories. The company has consumers in Asia, Middle East and CIS (Commonwealth of Independent States). Its registered office is in Mumbai.",screener
KLBRENG-B,Kilburn Engineering Ltd,,,"Kilburn Engineering Ltd. is engaged in designing, manufacturing and commissioning customized equipment / systems for critical applications in several industrial sectors like Chemical, Steel, Nuclear Power, Petrochemical and Food Processing etc.",screener
KMEW,Knowledge Marine & Engineering Works Ltd,Industrials,Marine Shipping,"Incorporated in 2015, Knowledge Marine & Engineering Works Ltd provides dredging services, owning and operating marine craft, and repairing, maintaining and refitting marine crafts and marine infrastructure",screener
KMSUGAR,KM Sugar Mills Ltd,Consumer Defensive,Confectioners,"Incorporated in 1971, KM Sugar Mills Ltd manufactures and trades sugar, ethanol, ethyl alcohol, and generation of power using bagasse",screener
KNAGRI,KN Agri Resources Ltd,Consumer Defensive,Farm Products,"Incorporated in 1987, KN Agri Resources Ltd is in the business of Agri Commodities and Power Generation.",screener
KNRCON,KNR Constructions Ltd,Industrials,Engineering & Construction,"KNR Constructions Ltd, incorporated in 1995, is a Hyderabad-based infrastructure project development company providing EPC services in segments such as roads and highways, irrigation and urban water infrastructure management.",screener
KOHINOOR,Kohinoor Foods Ltd,Consumer Defensive,Packaged Foods,"Incorporated in 1989, Kohinoor Foods Ltd does milling, processing and selling of rice, and trading of food products and other agri-commodities",screener
KOKUYOCMLN,Kokuyo Camlin Ltd,Industrials,Business Equipment & Supplies,"Incorporated in 1946, Kokuyo Camlin Ltd manufactures and trades consumer products viz. stationery and color products",screener
KOLTEPATIL,Kolte Patil Developers Ltd,Real Estate,Real Estate - Development,Business Overview Company is in real estate business (Residential & Commercial) with dominant presence in the Pune and growing presence in Mumbai and Bengaluru.,screener
KOPRAN,Kopran Ltd,Healthcare,Drug Manufacturers - General,Kopran Ltd. is a fully integrated pharmaceutical company that manufactures and supplies high-quality formulations and active pharmaceutical ingredients globally.,screener
KOTAKBANK,Kotak Mahindra Bank Ltd,Financial Services,Banks - Regional,"Kotak Mahindra Bank is a diversified financial services group providing a wide range of banking and financial services including Retail Banking, Treasury and Corporate Banking, Investment Banking, Stock Broking, Vehicle Finance, Advisory services, Asset Management, Life Insurance and General Insurance.",screener
KOTARISUG,Kothari Sugars & Chemicals Ltd,Consumer Defensive,Confectioners,"Incorporated in 1961,Kothari Sugars and Chemicals Limited (KSCL) are the Manufacturers of Sugar, Alcohol and Powerhaving units at Kattur and Sathamangalam, Tamilnadu.",screener
KOTHARIPET,Kothari Petrochemicals Ltd,Basic Materials,Specialty Chemicals,"Incorporated in 1990, Kothari Petrochemicals Ltd is the manufacturer of PolyIso Butylene",screener
KOTHARIPRO,Kothari Products Ltd,Industrials,Conglomerates,"Incorporated in 1983, Kothari Products Ltd is in the business of Real Estate and International Trade",screener
KOTIC,Kothari Industrial Corporation Ltd,,,"Incorporated in 1970, Kothari Industrial Corporation Ltd manufactures fertilizers, FMCG and Health Care products",screener
KOTYARK,Kotyark Industries Ltd,Basic Materials,Specialty Chemicals,"Incorporated in 2016, Kotyark Industries Ltd is in the business of bio-diesel manufacturing",screener
KOVAI,Kovai Medical Center & Hospital Ltd,Healthcare,Medical Care Facilities,Kovai Medical Center & Hospital Ltd is a Coimbatore-based company which is in the business of advanced healthcare services. It also forayed into education services in 2019 with the commencement of its new Medical College in Coimbatore.,screener
KPEL,K.P. Energy Ltd,Industrials,Engineering & Construction,"K.P. Energy(KPEL) is a part of the KP Group of Surat. It is involved in the development of utility scale wind power generation infrastructure. The major activities encompass siting of wind farms, acquisition of lands and permits, EPCC of wind projects, along with balance of plant (BoP) infrastructure. KPEL also owns and operates WTGs (Wind Turbine Generators) and solar power plant as an IPP( Independent Power Producers). The company undertakes projects principally in Gujarat.",screener
KPIGREEN,KPI Green Energy Ltd,Utilities,Utilities - Renewable,"Incorporated in 2008, KPI Green Energy Ltd is part of KP Group. They develop, build, own, manage, and maintain renewable power facilities (solar and wind solar hybrid power project) as an Independent Power Producer (IPP) and as a service provider to Captive Power Producers (CPPs) under the ‘Solarism’ brand.",screener
KPIL,Kalpataru Projects International Ltd,Industrials,Engineering & Construction,"Kalpataru Power Transmission Ltd is a global EPC player with diversified interest in power transmission and distribution, oil and gas pipeline, railways and biomass based power generation.",screener
KPITTECH,KPIT Technologies Ltd,Technology,Software - Infrastructure,"KPIT is a global technology company with software solutions that will help mobility leapfrog towards autonomous, clean, smart and connected future. With 13000+ Automobelievers across the globe, specializing in embedded software, AI & Digital solutions, KPIT enables customers accelerate implementation of next generation mobility technologies . With development centers in Europe, USA, Japan, China, Thailand and India",screener
KPL,Kwality Pharmaceuticals Ltd,,,"Incorporated in 1983, Kwality Pharma is in the business of manufacturing & trading in Pharmaceuticals & allied products",screener
KPRMILL,K P R Mill Ltd,Consumer Cyclical,Textile Manufacturing,"K.P.R. Mill is engaged in one of the largest vertically integrated apparel manufacturing Companies in India. The Company produces Yarn, Knitted Fabric, Readymade Garments and Wind power.",screener
KRBL,KRBL Ltd,Consumer Defensive,Packaged Foods,"KRBL is worlds leading basmati rice producer and has fully integrated operations in every aspect of basmati value chain, right from seed development, contract farming, procurement of paddy, storage, processing, packaging, branding and marketing.(Source : 202003 Annual Report Page No:181)",screener
KREBSBIO,Krebs Biochemicals & Industries Ltd,Healthcare,Drug Manufacturers - Specialty & Generic,"Incorporated in 1991, Krebs Biochemicals & Industries Ltd is presently engaged in manufacturing of active pharmaceutical ingredients.",screener
KRIDHANINF,Kridhan Infra Ltd,Basic Materials,Steel,"Incorporated in 2006, Kridhan Infra Ltd is in the business of trading in iron and steel and allied materials",screener
KRISHANA,Krishana Phoschem Ltd,Basic Materials,Agricultural Inputs,"Incorporated in 2004, Krishana Phoschem Ltd is in the business of manufacturing fertilisers & chemicals. It manufactures and markets fertilisers under the brands ‘Annadata’ (SSP) and ‘Bharat’ (NPK/DAP complex).",screener
KRISHIVAL,Krishival Foods Ltd,Consumer Defensive,Packaged Foods,"Incorporated in 2014, Krishival Foods Ltd is in the business of processing premium nuts, dry fruits, and ice cream.",screener
KRISHNADEF,Krishna Defence & Allied Industries Ltd,Industrials,Specialty Industrial Machinery,"Incorporated in 1997, Krishna Defence and Allied Industries Ltd designs, develops, and manufactures a wide range of equipment for defence, security, and dairy segments",screener
KRITI,Kriti Industries (India) Ltd,Industrials,Building Products & Equipment,"Incorporated in 1983, Kriti Industries Ltd manufactures premium quality piping products and solutions, accessories, gas pipe, telecom ducts, submersible pipes and casing pipes",screener
KRITIKA,Kritika Wires Ltd,Basic Materials,Steel,"Incorporated in 2004, Kritika Wires Ltd manufactures, exports and supplies a wide range of Industrial Steel Wires and Galvanised Wires",screener
KRITINUT,Kriti Nutrients Ltd,Consumer Defensive,Packaged Foods,"Incorporated in 1992, Kriti Nutrients Ltd is in the business of Soya Seed Extraction and Manufacturing & Selling of cooking oil",screener
KRN,KRN Heat Exchanger and Refrigeration Ltd,Technology,Electronic Components,"KRN Heat Exchanger and Refrigeration (KHERL), manufactures fin and tube-type heat exchangers for the Heat Ventilation Air Conditioning, and Refrigeration Industry.",screener
KRONOX,Kronox Lab Sciences Ltd,Basic Materials,Specialty Chemicals,"Incorporated in 2008, Kronox Lab Sciences Ltd manufactures High Purity Fine, inorganic chemicals, phosphate, and metallic chemicals",screener
KROSS,Kross Ltd,Consumer Cyclical,Auto Parts,"Incorporated in 1991, Kross Ltd manufactures high performance and safety critical components for the commercial vehicle, tractor and trailer axle industry",screener
KRSNAA,Krsnaa Diagnostics Ltd,Healthcare,Diagnostics & Research,"Krsnaa Diagnostics Ltd provides a range of technology-enabled diagnostic services such as imaging, clinical laboratory, and teleradiology services to hospitals, medical colleges, and community health centers across India with an extensive network across non-metro and lower-tier cities and towns.",screener
